code;name
26.30;Manufacture of communication equipment
26.40;Manufacture of consumer electronics
26.51;Manufacture of measuring, testing and navigation instruments and apparatus
26.52;Watchmaking
26.60;Manufacture of medical irradiation, electromedical and electrotherapeutic equipment
26.70;Manufacture of optical and photographic equipment
26.80;Manufacture of magnetic and optical media
27.11;Manufacture of electric motors, generators and transformers
27.12;Manufacture of electrical distribution and control equipment
27.20;Manufacture of batteries and accumulators
27.31;Manufacture of optical fiber cables
27.32;Manufacture of other electronic or electrical wires and cables
27.33;Manufacture of electrical installation equipment
27.40;Manufacture of electric lighting equipment
27.51;Manufacture of domestic appliances
27.52;Manufacture of non-electric household appliances
27.90;Manufacture of other electrical equipment
28.11;Manufacture of engines and turbines, except aircraft and vehicle engines
28.12;Manufacture of hydraulic and pneumatic equipment
28.13;Manufacture of other pumps and compressors
28.14;Manufacture of other valves and fittings
28.15;Manufacture of gears and mechanical transmission components
28.21;Manufacture of furnaces and burners
28.22;Manufacture of lifting and handling equipment
28.23;Manufacture of office machinery and equipment (except computers and peripheral equipment)
28.24;Manufacture of portable power tools
28.25;Manufacture of industrial air-conditioning and refrigeration equipment
28.29;Manufacture of general-purpose machinery
28.30;Manufacture of agricultural and forestry machinery
28.41;Manufacture of metal forming machines
28.49;Manufacture of other machine tools
28.91;Manufacture of metalworking machinery
28.92;Manufacture of mining and construction machinery
28.93;Manufacture of machinery for the food industry
28.94;Manufacture of machinery for the textile industry
28.95;Manufacture of machinery for the paper and cardboard industries
28.96;Manufacture of machinery for working rubber or plastics
28.99;Manufacture of other special-purpose machinery n.e.c.
29.10;Manufacture of motor vehicles
29.20;Manufacture of bodies and trailers
29.31;Manufacture of automotive electrical and electronic equipment
29.32;Manufacture of other automotive equipment
30.11;Shipbuilding and floating structures
30.12;Construction of pleasure boats
30.20;Construction of locomotives and other railway rolling stock
30.30;Manufacture of aircraft and spacecraft
30.40;Military combat vehicles
30.91;Manufacture of motorcycles
30.92;Manufacture of bicycles and invalid carriages
30.99;Manufacture of other transport equipment n.e.c.
31.01;Manufacture of office and store furniture
31.02;Manufacture of kitchen furniture
31.03;Manufacture of mattresses
31.09;Manufacture of other furniture
32.11;Coin minting
32.12;Manufacture of jewelry and related articles
32.13;Manufacture of costume jewelry and similar articles
32.20;Manufacture of musical instruments
32.30;Manufacture of sporting goods
32.40;Manufacture of toys and games
32.50;Manufacture of medical and dental instruments and supplies
32.91;Manufacture of brushware
32.99;Other manufacturing n.e.c.
33.11;Repair of metal structures
33.12;Repair of mechanical machinery and equipment
33.13;Repair of electronic and optical equipment
33.14;Repair of electrical equipment
33.15;Ship repair and maintenance
33.16;Repair and maintenance of aircraft and spacecraft
33.17;Repair and maintenance of other transport equipment
33.19;Repair of other equipment
33.20;Installation of industrial machinery and equipment
35.11;Power generation
35.12;Electricity transmission
35.13;Electricity distribution
35.14;Electricity trading
35.21;Production of gaseous fuels
35.22;Distribution of gaseous fuels through pipelines
35.23;Trade in piped gaseous fuels
35.30;Steam and air conditioning production and distribution
36.00;Water collection, treatment and distribution
37.00;Wastewater collection and treatment
38.11;Collection of non-hazardous waste
38.12;Hazardous waste collection
38.21;Treatment and disposal of non-hazardous waste
38.22;Hazardous waste treatment and disposal
38.31;Wreck dismantling
38.32;Sorted waste recovery
39.00;Depollution and other waste management services
41.10;Real estate development
41.20;Construction of residential and non-residential buildings
42.11;Road and highway construction
42.12;Construction of surface and underground railroads
42.13;Bridge and tunnel construction
42.21;Construction of fluid networks
42.22;Construction of electrical and telecommunications networks
42.91;Construction of maritime and fluvial structures
42.99;Construction of other civil engineering works n.e.c.
43.11;Demolition work
43.12;Site preparation work
43.13;Drilling and boring
43.21;Electrical installations
43.22;Plumbing, heating and air-conditioning installations
43.29;Other installation work
43.31;Plastering work
43.32;Carpentry work
43.33;Floor and wall covering work
43.34;Painting and glazing
43.39;Other finishing work
43.91;Roofing work
43.99;Other specialized construction work n.e.c.
45.11;Sale of cars and light motor vehicles
45.19;Trade in other motor vehicles
45.20;Maintenance and repair of motor vehicles
45.31;Wholesale of automotive equipment
45.32;Retail sale of automotive equipment
45.40;Trade and repair of motorcycles
46.11;Agents involved in the sale of agricultural raw materials, live animals, textile raw materials and semi-finished products
46.12;Agents involved in the sale of fuels, metals, minerals and chemicals
46.13;Agents involved in the sale of wood and building materials
46.14;Agents involved in the sale of machinery, industrial equipment, ships and aircraft
46.15;Agents involved in the sale of furniture, household goods and hardware
46.16;Agents involved in the sale of textiles, clothing, furs, footwear and leather goods
46.17;Agents specializing in the sale of food, beverages and tobacco
46.18;Agents specializing in the sale of other specific products
46.19;Intermediaries in the sale of miscellaneous products
46.21;Wholesale of cereals, unmanufactured tobacco, seeds and livestock feed
46.22;Wholesale of flowers and plants
46.23;Wholesale of live animals
46.24;Wholesale of hides and skins
46.31;Wholesale of fruit and vegetables
46.32;Wholesale of meat and meat products
46.33;Wholesale of dairy products, eggs, edible oils and fats
46.34;Wholesale of beverages
46.35;Wholesale of tobacco products
46.36;Wholesale of sugar, chocolate and confectionery
46.37;Wholesale of coffee, tea, cocoa and spices
46.38;Wholesale of other food products, including fish, crustaceans and molluscs
46.39;Non-specialized wholesale of food, beverages and tobacco
46.41;Wholesale of textiles
46.42;Wholesale of clothing and footwear
46.43;Wholesale of household appliances
46.44;Wholesale of crockery, glassware and cleaning products
46.45;Wholesale of perfumery and beauty products
46.46;Wholesale of pharmaceutical products
46.47;Wholesale of furniture, carpets and lighting equipment
46.48;Wholesale of watches, clocks and jewelry
46.49;Wholesale of other household goods
46.51;Wholesale of computers, peripheral computer equipment and software
46.52;Wholesale of electronic and telecommunications components and equipment
46.61;Wholesale of agricultural equipment
46.62;Wholesale of machine tools
46.63;Wholesale of mining, construction and civil engineering machinery
46.64;Wholesale of machinery for the textile and clothing industries
46.65;Wholesale of office furniture
46.66;Wholesale of other office machinery and equipment
46.69;Wholesale of other machinery and equipment
46.71;Wholesale of fuels and related products
46.72;Wholesale of ores and metals
46.73;Wholesale of wood, building materials and sanitary appliances
46.74;Wholesale of hardware, plumbing and heating supplies
46.75;Wholesale of chemical products
46.76;Wholesale of other intermediate products
46.77;Wholesale of waste and scrap
46.90;Non-specialized wholesale
47.11;Retail sale in non-specialized stores with food predominating
47.19;Other retail in non-specialized stores
47.21;Retail sale of fruit and vegetables in specialized stores
47.22;Retail sale of meat and meat products in specialized stores
47.23;Retail sale of fish, crustaceans and molluscs in specialized stores
47.24;Retail sale of bread, pastries and confectionery in specialized stores
47.25;Retail sale of beverages in specialized stores
47.26;Retail sale of tobacco products in specialized stores
47.29;Other food retailing in specialized stores
47.30;Fuel retailing in specialized stores
47.41;Retail sale of computers, peripherals and software in specialized stores
47.42;Retail sale of telecommunications equipment in specialized stores
47.43;Retail sale of audio/video equipment in specialized stores
47.51;Retail sale of textiles in specialized stores
47.52;Retail sale of hardware, paint and glass in specialized stores
47.53;Retail sale of carpets, wall and floor coverings in specialized stores
47.54;Retail sale of household appliances in specialized stores
47.59;Retail sale of furniture, lighting equipment and other household articles in specialized stores
47.61;Retail sale of books in specialized stores
47.62;Retail sale of newspapers and stationery in specialized stores
47.63;Retail sale of music and video recordings in specialized stores
47.64;Retail sale of sporting goods in specialized stores
47.65;Retail sale of games and toys in specialized stores
47.71;Retail sale of clothing in specialized stores
47.72;Retail sale of footwear and leather goods in specialized stores
47.73;Retail sale of pharmaceutical products in specialized stores
47.74;Retail sale of medical and orthopedic articles in specialized stores
47.75;Retail sale of perfume and beauty products in specialized stores
47.76;Retail sale of flowers, plants, seeds, fertilizers, pets and pet food in specialized stores
47.77;Retail sale of watches and jewelry in specialized stores
47.78;Other retail sale of new goods in specialized stores
47.79;Retail sale of second-hand goods in specialized stores
47.81;Food retailing in stalls and markets
47.82;Retail sale of textiles, clothing and footwear in stalls and markets
47.89;Other stall and market retail
47.91;Distance selling
47.99;Other non-store, stall or market retailing
49.10;Intercity passenger rail transport
49.20;Freight rail transport
49.31;Urban and suburban passenger transport
49.32;Passenger cab transport
49.39;Other passenger land transport n.e.c.
49.41;Road freight transport
49.42;Removal services
49.50;Pipeline transport
50.10;Maritime and coastal passenger transport
50.20;Sea and coastal freight transport
50.30;River passenger transport
50.40;River freight transport
51.10;Passenger air transport
51.21;Air freight transport
51.22;Space transportation
52.10;Warehousing and storage
52.21;Services incidental to land transport
52.22;Services incidental to water transportation
52.23;Services incidental to air transportation
52.24;Material handling
52.29;Other services auxiliary to transport
53.10;Postal activities within the framework of a universal service obligation
53.20;Other postal and courier activities
55.10;Hotels and similar accommodation
55.20;Tourist accommodation and other short-stay accommodation
55.30;Camping grounds and parks for caravans or recreational vehicles
55.90;Other accommodation
56.10;Restaurants and mobile catering
56.21;Catering services
56.29;Other catering services
56.30;Drinks outlets
58.11;Book publishing
58.12;Publishing of directories and address files
58.13;Newspaper publishing
58.14;Publishing of magazines and periodicals
58.19;Other publishing activities
58.21;Electronic games publishing
58.29;Other software publishing
59.11;Motion picture, video and television program production
59.12;Post-production of motion pictures, video and television programs
59.13;Motion picture, video and television program distribution
59.14;Motion picture projection
59.20;Sound recording and music publishing
60.10;Radio program publishing and broadcasting
60.20;Television programming and broadcasting
61.10;Wired telecommunications
61.20;Wireless telecommunications
61.30;Satellite telecommunications
61.90;Other telecommunications activities
62.01;Computer programming
62.02;IT consulting
62.03;IT facilities management
62.09;Other IT activities
63.11;Data processing, hosting and related activities
63.12;Internet portals
63.91;News agency activities
63.99;Other information services n.e.c.
64.11;Central banking activities
64.19;Other monetary intermediation
64.20;Activities of holding companies
64.30;Investment funds and similar financial entities
64.91;Leasing
64.92;Other credit distribution
64.99;Other financial services, except insurance and pension funding, n.e.c.
65.11;Life insurance
65.12;Other insurance
65.20;Reinsurance
65.30;Pension funds
66.11;Administration of financial markets
66.12;Securities and commodities brokerage
66.19;Other activities auxiliary to financial services, excluding insurance and pension funds
66.21;Risk and damage assessment
66.22;Activities of insurance agents and brokers
66.29;Other activities auxiliary to insurance and pension funding
66.30;Fund management
68.10;Real estate brokerage activities
68.20;Rental and operation of owned or leased real estate
68.31;Real estate agencies
68.32;Real estate administration
69.10;Legal services
69.20;Accounting activities
70.10;Head office activities
70.21;Public relations and communications consultancy
70.22;Business and other management consultancy
71.11;Architectural activities
71.12;Engineering activities
71.20;Technical testing and analysis
72.11;Biotechnology research and development
72.19;Research and development on other physical and natural sciences
72.20;Research and development on humanities and social sciences
73.11;Advertising agency activities
73.12;Media advertising management
73.20;Market research and surveys
74.10;Specialized design activities
74.20;Photographic activities
74.30;Translation and interpreting activities
74.90;Other professional, scientific and technical activities n.e.c.
75.00;Veterinary activities
77.11;Rental and leasing of cars and light motor vehicles
77.12;Truck rental and leasing
77.21;Rental and leasing of leisure and sporting goods
77.22;Rental and leasing of videocassettes and video discs
77.29;Rental and leasing of other personal and household goods
77.31;Rental and leasing of agricultural machinery and equipment
77.32;Rental and leasing of construction machinery and equipment
77.33;Rental and leasing of office machines and computer equipment
77.34;Rental and leasing of water transport equipment
77.35;Rental and leasing of air transport equipment
77.39;Rental and leasing of other machinery, equipment and tangible goods n.e.c.
77.40;Rental and leasing of intellectual property and similar products, except copyrighted works
78.10;Activities of employment agencies
78.20;Activities of temporary employment agencies
78.30;Other provision of human resources
79.11;Activities of travel agencies
79.12;Activities of tour operators
79.90;Other reservation services and related activities
80.10;Private security activities
80.20;Security systems activities
80.30;Investigation activities
81.10;Combined building support activities
81.21;Routine building cleaning
81.22;Other building and industrial cleaning activities
81.29;Other cleaning activities
81.30;Landscaping services
82.11;Combined office administrative services
82.19;Photocopying, document preparation and other specialized office support activities
82.20;Call center activities
82.30;Trade show and convention organization
82.91;Activities of bill collection agencies and customer financial information companies
82.92;Packaging activities
82.99;Other business support activities n.e.c.
84.11;General public administration
84.12;Public administration of health, education, culture and social services, other than social security
84.13;Public administration of economic activities
84.21;Foreign affairs
84.22;Defense
84.23;Justice
84.24;Public order and security activities
84.25;Fire and rescue services
84.30;Compulsory social security
85.10;Pre-primary education
85.20;Primary education
85.31;General secondary education
85.32;Technical or vocational secondary education
85.41;Post-secondary non-tertiary education
85.42;Higher education
85.51;Sports and leisure education
85.52;Cultural education
85.53;Driving lessons
85.59;Miscellaneous teaching
85.60;Teaching support activities
86.10;Hospital activities
86.21;General practitioners
86.22;Specialist activity
86.23;Dental practice
86.90;Other human health activities
87.10;Residential care
87.20;Social housing for mentally handicapped, mentally ill and drug addicts
87.30;Social housing for the elderly and physically handicapped
87.90;Other social housing activities
88.10;Social work without accommodation for the elderly and disabled
88.91;Social work without accommodation for young children
88.99;Other social work activities without accommodation n.e.c.
90.01;Performing arts
90.02;Support activities for performing arts
90.03;Artistic creation
90.04;Venue management
91.01;Library and archive management
91.02;Museum management
91.03;Management of historical sites and monuments and similar tourist attractions
91.04;Management of botanical and zoological gardens and nature reserves
92.00;Organization of games of chance and gambling
93.11;Management of sports facilities
93.12;Sports club activities
93.13;Activities of fitness centers
93.19;Other sports-related activities
93.21;Amusement and theme park activities
93.29;Other recreational and leisure activities
94.11;Activities of employers' and consular organizations
94.12;Activities of professional organizations
94.20;Activities of trade unions
94.91;Activities of religious organizations
94.92;Activities of political organizations
94.99;Activities of membership organizations n.e.c.
95.11;Repair of computers and peripheral equipment
95.12;Repair of communications equipment
95.21;Repair of consumer electronics
95.22;Repair of household appliances and home and garden equipment
95.23;Repair of shoes and leather goods
95.24;Repair of furniture and household equipment
95.25;Repair of watches and jewelry
95.29;Repair of other personal and household goods
96.01;Laundry and dry-cleaning
96.02;Hairdressing and beauty care
96.03;Funeral services
96.04;Personal care services
96.09;Other personal services n.e.c.
97.00;Activities of households as employers of domestic personnel
98.10;Undifferentiated goods-producing activities of private households for own use
98.20;Undifferentiated goods-producing activities of households for own use
99.00;Activities of extra-territorial organizations and bodies
01.11Z;Growing of cereals (except rice), pulses and oil seeds
01.12Z;Rice cultivation
01.13Z;Cultivation of vegetables, melons, roots and tubers
01.14Z;Sugar cane cultivation
01.15Z;Tobacco growing
01.16Z;Fiber crops
01.19Z;Other non-permanent crops
01.21Z;Grape growing
01.22Z;Tropical and subtropical fruit growing
01.23Z;Citrus growing
01.24Z;Pome and stone fruit growing
01.25Z;Growing of other tree and bush fruits and nuts
01.26Z;Growing of oleaginous fruits
01.27Z;Growing of beverage plants
01.28Z;Growing of spices, aromatic, medicinal and pharmaceutical plants
01.29Z;Other permanent crops
01.30Z;Plant breeding
01.41Z;Dairy cow farming
01.42Z;Raising of other cattle and buffaloes
01.43Z;Horse and other equine breeding
01.44Z;Camel and other camelid breeding
01.45Z;Sheep and goat farming
01.46Z;Pig farming
01.47Z;Poultry farming
01.49Z;Other animal husbandry
01.50Z;Associated crop and livestock farming
01.61Z;Support activities for crop production
01.62Z;Animal production support activities
01.63Z;Primary crop processing
01.64Z;Seed processing
01.70Z;Hunting, trapping and related services
02.10Z;Silviculture and other forestry activities
02.20Z;Forest harvesting
02.30Z;Harvesting of wild-growing non-timber forest products
02.40Z;Forestry support services
03.11Z;Sea fishing
03.12Z;Freshwater fishing
03.21Z;Marine aquaculture
03.22Z;Freshwater aquaculture
05.10Z;Hard coal mining
05.20Z;Lignite mining
06.10Z;Crude oil extraction
06.20Z;Natural gas extraction
07.10Z;Iron ore mining
07.21Z;Mining of uranium and thorium ores
07.29Z;Mining of other non-ferrous ores
08.11Z;Quarrying of ornamental and building stone, industrial limestone, gypsum, chalk and slate
08.12Z;Mining of gravel and sand pits, clays and kaolin
08.91Z;Extraction of chemical minerals and mineral fertilizers
08.92Z;Peat extraction
08.93Z;Salt production
08.99Z;Other mining and quarrying n.e.c.
09.10Z;Support activities for petroleum and natural gas extraction
09.90Z;Support activities for other mining and quarrying
10.11Z;Meat processing and preserving
10.12Z;Processing and preserving of poultry meat
10.13A;Industrial preparation of meat products
10.13B;Charcuterie
10.20Z;Processing and preserving of fish, crustaceans and mollusks
10.31Z;Potato processing and preservation
10.32Z;Preparation of fruit and vegetable juices
10.39A;Other vegetable processing and preservation
10.39B;Fruit processing and preservation
10.41A;Manufacture of crude oils and fats
10.41B;Manufacture of refined oils and fats
10.42Z;Manufacture of margarine and similar edible fats
10.51A;Manufacture of liquid milk and fresh products
10.51B;Manufacture of butter
10.51C;Manufacture of cheese
10.51D;Manufacture of other dairy products
10.52Z;Ice cream and sherbet manufacture
10.61A;Milling
10.61B;Other grain processing
10.62Z;Manufacture of starch products
10.71A;Industrial production of fresh bread and pastries
10.71B;Baking of bakery products
10.71C;Bakery and pastry-making
10.71D;Pastry-making
10.72Z;Manufacture of cookies, rusks and preserved pastries
10.73Z;Pasta manufacture
10.81Z;Sugar production
10.82Z;Manufacture of cocoa, chocolate and confectionery products
10.83Z;Tea and coffee processing
10.84Z;Manufacture of condiments and seasonings
10.85Z;Manufacture of prepared meals
10.86Z;Manufacture of homogenized and dietetic foods
10.89Z;Manufacture of other food products n.e.c.
10.91Z;Farm animal feed manufacturing
10.92Z;Manufacture of pet food
11.01Z;Production of distilled alcoholic beverages
11.02A;Sparkling wine production
11.02B;Wine-making
11.03Z;Manufacture of cider and fruit wines
11.04Z;Production of other non-distilled fermented beverages
11.05Z;Beer production
11.06Z;Malt production
11.07A;Table water industry
11.07B;Soft drinks production
12.00Z;Manufacture of tobacco products
13.10Z;Textile fiber preparation and spinning
13.20Z;Weaving
13.30Z;Textile finishing
13.91Z;Manufacture of knitted and crocheted fabrics
13.92Z;Manufacture of textile articles, except apparel
13.93Z;Manufacture of carpets and rugs
13.94Z;Manufacture of twine, cordage and netting
13.95Z;Manufacture of non-wovens, except apparel
13.96Z;Manufacture of other technical and industrial textiles
13.99Z;Manufacture of other textiles n.e.c.
14.11Z;Manufacture of leather clothing
14.12Z;Manufacture of workwear
14.13Z;Manufacture of outerwear
14.14Z;Manufacture of underwear
14.19Z;Manufacture of other wearing apparel and accessories
14.20Z;Manufacture of fur articles
14.31Z;Manufacture of knitted and crocheted footwear
14.39Z;Manufacture of other knitted and crocheted goods
15.11Z;"Finishing and tanning of leather; preparation and dyeing of furs"
15.12Z;Manufacture of travel goods, leather goods and saddlery
15.20Z;Manufacture of footwear
16.10A;Sawing and planing of wood, excluding impregnation
16.10B;Wood impregnation
16.21Z;Veneer and wood panel manufacturing
16.22Z;Manufacture of assembled parquet flooring
16.23Z;Manufacture of carpentry and other joinery
16.24Z;Manufacture of wooden packaging
16.29Z;"Manufacture of various wooden objects; manufacture of cork, basketry and straw goods"
17.11Z;Manufacture of paper pulp
17.12Z;Manufacture of paper and paperboard
17.21A;Manufacture of corrugated board
17.21B;Manufacture of cardboard boxes
17.21C;Manufacture of paper packaging
17.22Z;Manufacture of sanitary and household paper products
17.23Z;Manufacture of stationery
17.24Z;Manufacture of wallpaper
17.29Z;Manufacture of other paper and paperboard products
18.11Z;Newspaper printing
18.12Z;Other commercial printing
18.13Z;Pre-press activities
18.14Z;Bookbinding and related activities
18.20Z;Reproduction of recordings
19.10Z;Coking
19.20Z;Oil refining
20.11Z;Manufacture of industrial gases
20.12Z;Dye and pigment manufacture
20.13A;Enrichment and reprocessing of nuclear materials
20.13B;Manufacture of other basic inorganic chemicals n.e.c.
20.14Z;Manufacture of other basic organic chemicals
20.15Z;Manufacture of nitrogen products and fertilizers
20.16Z;Manufacture of basic plastics
20.17Z;Manufacture of synthetic rubber
20.20Z;Manufacture of pesticides and other agrochemicals
20.30Z;Manufacture of paints, varnishes, inks and mastics
20.41Z;Manufacture of soaps, detergents and cleaning products
20.42Z;Manufacture of perfumes and toiletries
20.51Z;Manufacture of explosives
20.52Z;Manufacture of glues
20.53Z;Manufacture of essential oils
20.59Z;Manufacture of other chemical products n.e.c.
20.60Z;Manufacture of man-made fibres
21.10Z;Manufacture of basic pharmaceutical products
21.20Z;Manufacture of pharmaceutical preparations
22.11Z;Manufacture and retreading of tires
22.19Z;Manufacture of other rubber products
