code;name
92.00Z;Organization of games of chance and gambling
93.11Z;Management of sports facilities
93.12Z;Sports club activities
93.13Z;Activities of fitness centers
93.19Z;Other sports-related activities
93.21Z;Amusement and theme park activities
93.29Z;Other recreational and leisure activities
94.11Z;Activities of employers' and consular organizations
94.12Z;Activities of professional organizations
94.20Z;Activities of trade unions
94.91Z;Activities of religious organizations
94.92Z;Activities of political organizations
94.99Z;Other voluntary organizations
95.11Z;Repair of computers and peripheral equipment
95.12Z;Repair of communications equipment
95.21Z;Consumer electronics repair
95.22Z;Repair of household appliances and home and garden equipment
95.23Z;Repair of footwear and leather goods
95.24Z;Repair of furniture and household equipment
95.25Z;Repair of watches and jewelry
95.29Z;Repair of other personal and household goods
96.01A;Laundry and dry cleaning wholesale
96.01B;Retail laundry-dyeing
96.02A;Hairdressing
96.02B;Beauty care
96.03Z;Funeral services
96.04Z;Body care
96.09Z;Other personal services n.e.c.
97.00Z;Activities of households as employers of domestic personnel
98.10Z;Undifferentiated goods-producing activities of private households for own use
98.20Z;Undifferentiated goods-producing activities of households for own use
99.00Z;Activities of extra-territorial organizations and bodies
